Question,Option1,Option2,Option3,Option4,Correct Answer
What is the definition of cell culture?,The study of cells in their natural environment,The removal and growth of cells in an artificial environment,The process of fixing and staining cells,The microscopic examination of intact tissues,B
Cell culture allows observation under which microscope?,Electron Microscope,Bright-Field Microscope,Phase-Contrast Microscope,Stereomicroscope,C
In which field is cell culture essential for vaccine production?,Geology,Virology,Botany,Anatomy,B
Which is a medical application of cell culture?,Building architectural models,Karyotyping and cancer research,Performing surgery on intact animals,Creating new elements,B
What is a key use in regenerative medicine?,To fix damaged organs in place,To replace damaged cells using cultured stem cells,To create synthetic food,To study rock formations,B
Cell culture is used in manufacturing what?,Antibiotics and therapeutic hormones,Plastic materials,Metallic alloys,Construction materials,A
For which purpose is it used in cancer research?,To build cancer hospitals,For novel chemotherapeutic drug screening,To diagnose cancer with X-rays,To perform radiation therapy,B
What does cell culture provide for cell biologists?,A single type of cell for all experiments,Different cells for different experiments,Intact animals for study,Pre-stained tissue sections,B
In vitro means cells are grown...,In a glass container in an artificial environment,Inside a living animal,On a tree,In a vacuum chamber,A
Which cells are used in regenerative medicine?,Only nerve cells,Cultured stem cells,Only muscle cells,Only skin cells,B
Cell culture is impossible for many experiments in what setting?,In a petri dish,In intact animals,In a test tube,Under a microscope,B
What is studied in virology using cell culture?,Animal behavior,Plant growth,Virus proteins and vaccine production,Mineral composition,C
Which therapeutic hormone can be produced?,Growth hormone,Adrenaline,Thyroxine,Insulin,A
What does cell culture allow that is difficult in vivo?,Observe cellular behavior directly under a microscope,Study the entire human brain at once,See the colors of cells without staining,Measure the weight of an organ,A
Why is cell culture used for karyotyping?,It requires intact organs,It supplies cells for chromosome analysis,It is cheaper than using a microscope,It can only be done on plant cells,B
It facilitates study of interactions between?,Cancer cells and the immune system,The nervous and muscular systems,The skeletal and digestive systems,The heart and lungs,A
The production of antibiotics relies on which technique?,Paraffin technique,Cell culture,Freezing technique,Electron microscopy,B
What is a potential cell source for regenerative medicine?,Cultured stem cells,Red blood cells,Calcified bone cells,Mature neurons,A
In drug screening agents are tested on what?,Live patients directly,Cultured cancer cells,Intact animals only,Mineral samples,B
Cell culture is essential for experiments impossible where?,In a computer simulation,In a chemistry lab,In intact animals,In a physics lab,C
A company needs to produce a new vaccine. Which technology is crucial?,Cell Culture,Paraffin Embedding,Light Microscopy,Centrifugation,A
Why use cell culture to test a new drug on cancer cells initially?,It is more ethical and allows controlled observation,It is more expensive and time-consuming,The results are less accurate,Live animals are not affected by cancer drugs,A
Cells are observed dividing in a plastic dish. What technique is being used?,Histology,Cell Culture,Karyotyping,Microtomy,B
What is an advantage for manufacturing therapeutic hormones?,It requires the use of whole animal glands,It allows for large-scale controlled production,It is a very slow process,The hormones produced are always ineffective,B
What is the role of cell culture in karyotyping?,It is used to stain chromosomes,It provides a source of dividing cells for analysis,It is a type of chromosome,It replaces the need for a microscope,B
A bone marrow transplant is an example of?,Regenerative medicine,Virology,Karyotyping,Drug detoxification,A
Why is cell culture important for studying specific cell types?,It allows study without influence from other cell types,It is the only way to see their color,It makes them divide faster,It turns them into stem cells,A
What does in vitro literally mean?,In glass; cells grown in culture dishes,In life; cells studied in living animals,In vacuum; cells in a vacuum chamber,In water; cells grown in water only,A
Which technique depends on cell culture for cells?,Gram staining,Polymerase chain reaction (PCR),Karyotyping,Blood pressure measurement,C
Cell culture revolutionizes vaccine production by allowing?,The growth of viruses in eggs only,The culture of infected cells for virus proteins,The use of whole animals for every batch,The elimination of all vaccines,B
In regenerative medicine what is the potential of cultured stem cells?,To become any cell type and replace damaged tissues,To only become blood cells,To cause more damage,To be used as a food source,A
A common container for cell culture is?,A rotatory microtome,A glass slide,A petri dish or culture flask,A test tube only,C
How does cell culture contribute to toxicology?,By testing chemical effects on cultured cells,By studying effects on whole planets,By ignoring chemical effects,By only using computer models,A
The ability to observe cells under a phase-contrast microscope is a key benefit of?,Fixed tissue sections,Cell culture,Electron microscopy,Autopsy,B
For what purpose use cultured cells from a genetic disorder patient?,To study the disorder at a cellular level,To cure the disorder instantly,To create a new organ in a day,To change the patients DNA directly,A
What is a prerequisite for successful cell culture?,A favorable artificial environment,Complete darkness at all times,Extremely high temperatures,The absence of any nutrients,A
Insulin production is an example of?,Manufacturing of biopharmaceuticals,Karyotyping,Regenerative medicine,Virology,A
Heart muscle cells beating in a dish is an application of?,Generation of experimental models,Drug delivery,Karyotyping,Virology,A
Why is cell culture a fundamental tool?,It allows controlled experimentation on living cells outside the body,It is the oldest known biological technique,It requires no specialized equipment,It can only be used for animal cells,A
What is the original source of cells?,They are created from chemicals,They are removed from an animal or human,They are mined from the earth,They come from plant leaves,B
Cell culture is essential for impossible in vivo experiments because it?,Allows manipulation at a cellular level,Is more expensive,Is less accurate,Uses smaller microscopes,A
In which application test a new drug with liver cells?,Drug detoxification studies,Karyotyping,Regenerative medicine,Virology,A
What is the main goal in cancer research?,To cause cancer in healthy cells,To screen novel chemotherapeutic drugs,To replace all cancer cells with cultured ones,To ignore the immune system,B
Using cultured stem cells for spinal cord injuries is?,Virology,Regenerative medicine,Karyotyping,Drug manufacturing,B
How does cell culture aid virology?,By culturing infected cells to produce and study viruses,By killing all viruses,By making viruses visible to the naked eye,By using viruses to culture cells,A