Question, Option1, Option2, Option3, Option4, Correct Answer
The embryonic period occurs from the to the eighth week, Second, Third, Fourth, Fifth, B
The embryonic period is the time of, Cleavage, Organogenesis, Implantation, Fertilization, B
By the end of the embryonic period the main organ systems are, Established, Fully functional, Degenerated, Absent, A
The major external body form is recognizable by the end of the, First month, Second month, Third month, Fourth month, B
At the beginning of the third week the embryonic disc is broader in the region, Caudal, Cranial, Lateral, Ventral, B
The notochord induces the overlying ectoderm to form the, Neural plate, Heart, Liver, Lungs, A
The neuroectoderm is formed by induction from the, Prechordal plate, Notochord and prechordal mesoderm, Cloacal membrane, Primitive streak, B
Neurulation is the process of formation, Neural tube, Notochord, Somites, Heart, A
The neural plate has a shape, Round, Slipper-shaped, Square, Triangular, B
The neural plate expands toward the, Primitive streak, Prechordal plate, Cloacal membrane, Amnion, A
The elevated edges of the neural plate are the, Neural grooves, Neural folds, Neural tubes, Neural crests, B
The depressed midregion of the neural plate is the, Neural fold, Neural groove, Neural tube, Neural crest, B
The neural folds approach each other in the, Lateral midline, Dorsal midline, Ventral midline, Caudal midline, B
Fusion of the neural folds begins in the region, Cranial, Caudal, Cervical, Lumbar, C
Fusion proceeds and, Cranially and caudally, Dorsally and ventrally, Laterally and medially, Anteriorly and posteriorly, A
The structure formed by fusion is the, Neural plate, Neural groove, Neural tube, Neural crest, C
Until fusion is complete the neural tube communicates with the amniotic cavity via the, Neural folds, Neuropores, Neural groove, Notochord, B
The cranial neuropore closes at day, 20, 25, 30, 35, B
The caudal neuropore closes at day, 25, 27, 29, 31, B
After neurulation the central nervous system is a, Solid rod, Hollow tube, Flat plate, Cyst, B
The caudal portion of the neural tube forms the, Brain, Spinal cord, Heart, Liver, B
The cephalic portion forms the, Spinal cord, Brain vesicles, Notochord, Somites, B
Neural crest cells dissociate from the, Neural plate, Neural groove, Neural folds, Neural tube, C
Neural crest cells migrate into the underlying, Ectoderm, Mesoderm, Endoderm, Trophoblast, B
The embryonic period is when each germ layer gives rise to, Specific tissues and organs, The placenta, The umbilical cord, The amniotic fluid, A
The ectoderm gives rise to the, Digestive system, Nervous system and skin, Circulatory system, Muscular system, B
The mesoderm gives rise to the, Nervous system, Muscles bones and circulatory system, Skin and nerves, Digestive epithelium, B
The endoderm gives rise to the, Epidermis, Lining of the gut and respiratory tract, Skeleton, Heart, B
By the end of the embryonic period the embryo has a, Human appearance, Unrecognizable form, Animal-like form, Plant-like form, A
The head and neck regions develop from the, Pharyngeal arches, Limb buds, Somites, Neural crest, A
The limb buds appear during the, Third week, Fourth week, Fifth week, Sixth week, B
The heart begins to beat during the, Third week, Fourth week, Fifth week, Sixth week, B
The embryonic heart is formed from, Cardiogenic area, Neural crest, Pharyngeal arches, Somites, A
The digestive system develops from the, Ectoderm, Endoderm, Mesoderm, Trophoblast, B
The liver and pancreas develop from the, Ectoderm, Endoderm, Mesoderm, Neural crest, B
The urinary system develops from the, Ectoderm, Intermediate mesoderm, Endoderm, Neural crest, B
The reproductive system develops from the, Ectoderm, Intermediate mesoderm, Endoderm, Neural crest, B
The skeletal system develops from the, Ectoderm, Paraxial mesoderm, Endoderm, Neural crest, B
The muscular system develops from the, Ectoderm, Paraxial mesoderm, Endoderm, Neural crest, B
The skin develops from the, Surface ectoderm and mesoderm, Endoderm only, Neural crest only, Trophoblast, A
The nervous system develops from the, Neuroectoderm, Mesoderm, Endoderm, Trophoblast, A
Neural crest cells give rise to, The brain and spinal cord, Peripheral nerves and ganglia, The heart tube, The gut tube, B
The face develops from the, Pharyngeal arches, Limb buds, Somites, Neural tube, A
The eyes develop from the, Ectoderm and mesoderm, Endoderm only, Trophoblast, Decidua, A
The ears develop from the, Ectoderm and mesoderm, Endoderm only, Mesoderm only, Trophoblast, A
The embryonic period is a critical time for, Implantation, Teratogen exposure, Fertilization, Ovulation, B
Birth defects often originate during the, Embryonic period, Fetal period, Pre-implantation period, Postnatal period, A
The size of the embryo during this period is measured as, Crown-rump length, Crown-heel length, Weight, Head circumference, A
By the end of the eighth week the embryo is about long, 1 cm, 2-3 cm, 5 cm, 10 cm, B
The embryo has a tail that later, Grows, Disappears, Becomes the spine, Forms the limbs, B
The embryonic period ends when the embryo becomes a, Zygote, Fetus, Neonate, Infant, B
The fetal period begins at the, Eighth week, Twelfth week, Sixteenth week, Twentieth week, A
Organogenesis is mostly complete by the end of the, Embryonic period, Fetal period, Pre-implantation period, Postnatal period, A
The embryonic period is characterized by rapid, Growth and differentiation, Weight gain, Fat deposition, Bone maturation, A
The external genitalia are formed but not distinguishable until the, Embryonic period, Fetal period, Pre-implantation period, Postnatal period, B
The embryonic period is when the placenta becomes, Fully functional, Degenerated, Invasive, Expelled, A
The umbilical cord is formed from the, Body stalk, Yolk sac, Amnion, Chorion, A
The amniotic cavity surrounds the embryo by the, Fourth week, Sixth week, Eighth week, Tenth week, A
The yolk sac is incorporated into the, Umbilical cord, Embryo, Placenta, Decidua, A
The allantois is involved in the development of the, Heart, Urinary bladder, Lungs, Liver, B
The embryonic period is when the major body cavities form including the, Pericardial pleural and peritoneal, Cranial and spinal, Orbital and nasal, Synovial, A
The diaphragm develops during the, Embryonic period, Fetal period, Pre-implantation period, Postnatal period, A
The separation of the heart chambers occurs during the, Embryonic period, Fetal period, Pre-implantation period, Postnatal period, A
The embryonic period is a time of high vulnerability to, Nutrients, Teratogens, Oxygen, Water, B
Alcohol and drugs can cause birth defects if exposed during the, Embryonic period, Fetal period, Pre-implantation period, Postnatal period, A
The neural tube defects occur due to failure of, Neurulation, Gastrulation, Cleavage, Fertilization, A
Folic acid supplementation reduces the risk of, Heart defects, Neural tube defects, Limb defects, Digestive defects, B
The embryonic period sets the stage for all future, Development, Diseases, Aging, Death, A