Question,Option A,Option B,Option C,Option D,Correct Answer
A 22-year-old medical student is studying anatomical position. Which description correctly defines this position?,Standing erect with palms facing backward,Standing erect with palms facing forward,Sitting with arms at sides,Lying down with arms extended,B
During a physical examination a physician notes a skin lesion on the patient's palm. This area has:,Thin skin with few sweat glands,Thick skin with numerous sweat glands,Thin skin with sebaceous glands,Thick skin with hair follicles,B
A patient presents with muscle weakness. The physician explains that skeletal muscle has all these properties EXCEPT:,Excitability,Contractibility,Elasticity,Involuntary action,D
A 45-year-old construction worker fractures his femur. Which type of bone is the femur?,Short bone,Long bone,Flat bone,Irregular bone,B
During anatomy lab students examine a joint between skull bones. This immobile joint is called:,Symphysis,Synchondrosis,Suture,Synovial joint,C
A trauma patient has multiple rib fractures. Which part of the skeletal system contains the ribs?,Appendicular skeleton,Axial skeleton,Pectoral girdle,Pelvic girdle,B
A 60-year-old patient has difficulty swallowing. Which part of the digestive system is directly involved in swallowing?,Esophagus,Pharynx,Stomach,Duodenum,B
A smoker presents with chronic cough. The respiratory epithelium lining his airways is:,Simple squamous,Pseudostratified ciliated columnar,Stratified squamous,Transitional epithelium,B
A patient with head injury shows neurological deficits. The brain and spinal cord comprise the:,Peripheral nervous system,Central nervous system,Autonomic nervous system,Somatic nervous system,B
A cardiac patient has blocked coronary arteries. These arteries supply blood to:,Lungs,Liver,Brain,Heart,D
A 35-year-old female has urinary tract infection. The kidneys are located in which position?,Intraperitoneal,Retroperitoneal,Subcutaneous,Intrathoracic,B
During embryonic development which germ layer gives rise to the nervous system?,Ectoderm,Mesoderm,Endoderm,Neuroectoderm,A
Which anatomical plane divides the body into anterior and posterior portions?,Sagittal plane,Coronal plane,Transverse plane,Median plane,B
The skin layer that contains melanocytes and provides waterproof barrier is:,Dermis,Hypodermis,Epidermis,Subcutaneous tissue,C
A muscle that has a spindle-shaped belly with extended fibers is classified as:,Strap muscle,Fusiform muscle,Quadrilateral muscle,Pennate muscle,B
Bone cells responsible for bone resorption are:,Osteoblasts,Osteocytes,Osteoclasts,Chondrocytes,C
The most common type of cartilage found in ribs and trachea is:,Elastic cartilage,Fibrocartilage,Hyaline cartilage,Articular cartilage,C
Joints between vertebrae that contain fibrocartilage are classified as:,Fibrous joints,Primary cartilaginous joints,Secondary cartilaginous joints,Synovial joints,C
The skeletal system component that consists of 126 bones is:,Axial skeleton,Appendicular skeleton,Thoracic cage,Vertebral column,B
The first part of alimentary canal that contains hard and soft palate is:,Pharynx,Esophagus,Mouth,Stomach,C
The liver receives blood vessels and ducts at the:,Porta hepatis,Gall bladder fossa,Bare area,Falciform ligament,A
Gas exchange in lungs occurs in the:,Bronchi,Bronchioles,Alveoli,Trachea,C
The part of brain responsible for coordination and balance is:,Cerebrum,Cerebellum,Brainstem,Diencephalon,B
Blood vessels that carry blood away from the heart are:,Veins,Venules,Arteries,Capillaries,C
Lymphatic vessels are absent in all these EXCEPT:,Brain,Cornea,Cartilage,Liver,D
During second week of development the process of implantation occurs in:,Ovary,Fallopian tube,Uterus,Cervix,C
The study of normal structure of organs by naked eye is called:,Histology,Macroscopic anatomy,Developmental anatomy,Applied anatomy,B
Movement that decreases angle between two structures is:,Extension,Flexion,Abduction,Adduction,B
The body cavity that contains heart and lungs is:,Cranial cavity,Abdominal cavity,Thoracic cavity,Pelvic cavity,C
The layer of skin that contains papillae forming fingerprints is:,Epidermis,Papillary dermis,Reticular dermis,Hypodermis,B
Sweat glands that are confined to axillae and genital regions are:,Eccrine glands,Apocrine glands,Sebaceous glands,Ceruminous glands,B
Deep fascia is characterized by all EXCEPT:,Non-elastic,Dense fibrous tissue,Absent in face,Contains adipose tissue,D
Cardiac muscle is characterized by:,Voluntary action,Multinucleated cells,Branched striated fibers,Spindle-shaped cells,C
The connective tissue that surrounds entire muscle is:,Endomysium,Perimysium,Epimysium,Superficial fascia,C
The smallest functional unit of skeletal muscle is:,Myofibril,Sarcomere,Sarcolemma,Sarcoplasm,B
Muscles where fascicles insert into only one side of tendon are:,Unipennate,Bipennate,Multipennate,Circumpennate,A
The muscle that performs desired movement is called:,Antagonist,Prime mover,Synergist,Fixator,B
A closed fibrous sac lined by synovial membrane that prevents rubbing is:,Synovial sheath,Tendon,Aponeurosis,Synovial bursa,D
Bone matrix contains organic materials and:,Inorganic salts,Water,Lipids,Proteins,A
The outer surface of bones is covered by:,Endosteum,Periosteum,Articular cartilage,Medullary cavity,B
Red bone marrow is primarily found in:,Shaft of long bones,Medullary cavity,Ends of long bones,Compact bone,C
Bones developed by intramembranous ossification include:,Femur,Humerus,Skull vault,Vertebrae,C
The growing end of diaphysis in long bones is called:,Epiphysis,Metaphysis,Articular cartilage,Periosteum,B
Blood supply to inner 2/3 of bone cortex comes from:,Periosteal vessels,Nutrient vessels,Metaphyseal vessels,Epiphyseal vessels,B
Small nodular bones inside tendons that prevent friction are:,Short bones,Flat bones,Sesamoid bones,Irregular bones,C
Cartilage that contains yellow elastic fibers is found in:,Intervertebral discs,Epiglottis,Articular surfaces,Epiphyseal plates,B
Joints held together by very short interconnecting fibers are:,Syndesmosis,Suture,Gomphosis,Symphysis,B
The joint between tooth and its socket is classified as:,Suture,Syndesmosis,Gomphosis,Synchondrosis,C
Temporary cartilaginous joints in long bones are:,Symphysis,Synchondrosis,Syndesmosis,Suture,B
Structures found inside synovial joints include all EXCEPT:,Articular disc,Intra-articular ligaments,Muscle tendon,Articular cartilage,D
Joints that allow movement around single axis are:,Plane joints,Uni-axial joints,Bi-axial joints,Multi-axial joints,B
The shoulder joint is an example of:,Hinge joint,Pivot joint,Ball and socket joint,Saddle joint,C
The skull contains how many bones?,206 bones,22 bones,33 bones,126 bones,B
The only bone that does not articulate with other bones is:,Mandible,Hyoid bone,Ethmoid bone,Sphenoid bone,B
The vertebral column typically contains how many vertebrae?,22 vertebrae,31 vertebrae,33 vertebrae,26 vertebrae,C
Ribs that articulate directly with sternum are called:,False ribs,Floating ribs,True ribs,Vertebral ribs,C
The longest and strongest bone in human body is:,Humerus,Femur,Tibia,Fibula,B
Bones of the wrist are classified as:,Long bones,Short bones,Flat bones,Irregular bones,B
The alimentary canal is approximately how long?,2 meters,6 meters,9 meters,12 meters,C
Salivary glands that open opposite upper second molar are:,Submandibular,Sublingual,Parotid,All salivary glands,C
The stomach part that lies above cardiac orifice is:,Body,Pylorus,Fundus,Antrum,C
The C-shaped first part of small intestine is:,Jejunum,Ileum,Duodenum,Cecum,C
The large intestine feature that consists of longitudinal muscular bands is:,Sacculations,Haustra,Taeniae coli,Appendices epiploicae,C
The liver lobe that is smaller is:,Right lobe,Left lobe,Caudate lobe,Quadrate lobe,B
The pancreas part that lies in concavity of duodenum is:,Head,Neck,Body,Tail,A
The nasal region concerned with smell sensation is:,Nasal vestibule,Respiratory part,Olfactory part,All nasal regions,C
The larynx cartilage that forms Adam's Apple is:,Cricoid,Thyroid,Epiglottic,Arytenoid,B
The right main bronchus is characterized as:,Long and horizontal,Short and vertical,Equal to left,Narrow and curved,B
The lung that has cardiac notch and lingula is:,Right lung,Left lung,Both lungs,Neither lung,B
The nervous system division that controls skeletal muscle is:,Autonomic nervous system,Somatic nervous system,Enteric nervous system,Central nervous system,B
The brain part that contains cerebral aqueduct is:,Cerebrum,Midbrain,Pons,Medulla oblongata,B
Cranial nerves attached to medulla oblongata include:,Oculomotor and trochlear,Trigeminal and abducens,Facial and vestibulocochlear,Glossopharyngeal and vagus,D
Spinal nerves that form plexuses are:,Posterior rami,Anterior rami,Both rami,Roots only,B
The heart chamber that receives oxygenated blood is:,Right atrium,Right ventricle,Left atrium,Left ventricle,C
The valve between right atrium and ventricle is:,Mitral valve,Tricuspid valve,Aortic valve,Pulmonary valve,B
Blood vessels that have valves are:,Arteries,Arterioles,Veins,Capillaries,C
The largest lymphoid organ that filters blood is:,Lymph nodes,Spleen,Tonsils,Thymus,B
The study of intrauterine development is called:,Macroscopic anatomy,Developmental anatomy,Applied anatomy,Surface anatomy,B
Movement of foot so toes point downward is:,Dorsiflexion,Plantarflexion,Inversion,Eversion,B
The body cavity lined by meninges is:,Thoracic cavity,Abdominal cavity,Ventral cavity,Dorsal cavity,D
Muscle attachment by expanded fibrous sheet is:,Fleshy attachment,Tendon,Aponeurosis,Synovial sheath,C
Bone function that includes calcium storage is:,Protection,Movement,Mineral storage,Hematopoiesis,C
Cartilage found in intervertebral discs is:,Hyaline cartilage,Elastic cartilage,Fibrocartilage,All types,C
Joints between carpal bones are examples of:,Hinge joints,Plane joints,Pivot joints,Ball and socket joints,B
The bone that forms forehead is:,Parietal bone,Occipital bone,Frontal bone,Temporal bone,C
The part of sternum that is most inferior is:,Manubrium,Body,Xiphoid process,All parts equally,C
The bone in forearm that is lateral is:,Ulna,Radius,Both equally,Neither bone,B
The part of stomach that has pyloric sphincter is:,Fundus,Body,Pylorus,Cardia,C
The pancreatic duct that opens with bile duct is:,Accessory duct,Main duct,Both ducts,Neither duct,B
The part of respiratory system with vocal cords is:,Nasopharynx,Oropharynx,Larynx,Trachea,C
The lung with three lobes is:,Right lung,Left lung,Both lungs,Neither lung,A
The brain part concerned with vision is:,Frontal lobe,Parietal lobe,Temporal lobe,Occipital lobe,D
The heart layer that is muscular is:,Epicardium,Myocardium,Endocardium,Pericardium,B
The lymphatic tissue in ileum is called:,Tonsils,Peyer's patches,Thymus,Spleen,B

A 45-year-old patient presents with muscle weakness and gastrointestinal disorders. Mitochondrial dysfunction is suspected. Which organelle is primarily affected?,Mitochondria,Endoplasmic reticulum,Golgi apparatus,Lysosomes,A
During tissue processing for light microscopy which step prevents autolysis by stabilizing lysosomes?,Fixation,Dehydration,Clearing,Sectioning,A
A biopsy sample needs rapid intra-operative analysis. Which technique would be most appropriate?,Freezing technique,Paraffin technique,Immunohistochemistry,Enzyme histochemistry,A
All of the following are characteristics of the cell membrane EXCEPT:,Trilaminar appearance under EM,Contains cholesterol for stability,Composed mainly of carbohydrates,Has integral and peripheral proteins,C
Which of the following statements correctly distinguishes rough and smooth endoplasmic reticulum?,RER has ribosomes; SER lacks ribosomes,RER is for lipid synthesis; SER is for protein synthesis,RER appears acidophilic; SER appears basophilic,RER is continuous with nuclear outer membrane; SER is not,A
A patient with jaundice is found to have underdeveloped SER in liver cells. What is the primary function compromised?,Drug detoxification,Calcium storage,Protein synthesis,Glycogen metabolism,A
Which cellular component is responsible for packaging and sorting macromolecules?,Golgi apparatus,Mitochondria,Endoplasmic reticulum,Lysosomes,A
A 60-year-old patient presents with accumulated lipofuscin in cardiac muscle cells. This pigment represents:,Residual bodies from lysosomal digestion,Newly synthesized proteins,Stored glycogen,Active mitochondria,A
Which of the following is NOT a function of lysosomes?,ATP generation,Digestion of foreign material,Autophagy of old organelles,Release of enzymes outside cell,A
Which organelle contains catalase to break down hydrogen peroxide?,Peroxisomes,Lysosomes,Mitochondria,Golgi apparatus,A
A cell culture is being observed for cellular behavior. Which microscope type is most suitable?,Phase-contrast microscope,Bright-field microscope,Electron microscope,Fluorescence microscope,A
Which of the following is NOT a difference between light and electron microscopes?,Light microscope uses light; EM uses electrons,Light microscope shows color; EM shows black and white,Light microscope can view living specimens; EM cannot,Light microscope has higher resolution; EM has lower resolution,D
During paraffin technique which step makes tissue transparent?,Clearing,Fixation,Dehydration,Impregnation,A
A patient with a lysosomal storage disorder cannot degrade glycogen. Which organelle is dysfunctional?,Lysosomes,Peroxisomes,Mitochondria,Smooth ER,A
Which statement about hematoxylin and eosin staining is correct?,Hematoxylin stains nuclei blue; eosin stains cytoplasm pink,Hematoxylin stains cytoplasm blue; eosin stains nuclei pink,Both are acidic dyes,Both stain basophilic structures,A
All of the following are membranous organelles EXCEPT:,Mitochondria,Endoplasmic reticulum,Ribosomes,Lysosomes,C
A 50-year-old smoker presents with carbon particles in lung macrophages. These particles represent which type of inclusion?,Exogenous pigment,Endogenous pigment,Stored food,Crystals,A
Which organelle is known as the powerhouse of the cell?,Mitochondria,Golgi apparatus,Endoplasmic reticulum,Nucleus,A
Which of the following correctly describes nuclear pores?,Regulate molecular transport between nucleus and cytoplasm,Are present only in active cells,Allow free passage of all molecules,Are visible with light microscopy,A
A cell with abundant free ribosomes is most likely engaged in:,Protein synthesis for local use,Protein synthesis for export,Lipid synthesis,Glycogen storage,A
A karyotype analysis reveals 47 chromosomes with trisomy 21. This finding is characteristic of:,Down syndrome,Turner syndrome,Klinefelter syndrome,Cri du chat syndrome,A
Which of the following is NOT a component of the cell membrane?,Phospholipids,Proteins,Carbohydrates,DNA,D
A patient with gout has uric acid crystal deposition in joints. These crystals represent which type of inclusion?,Crystals,Stored food,Endogenous pigment,Exogenous pigment,A
Which organelle is responsible for calcium storage in muscle cells?,Smooth endoplasmic reticulum,Rough endoplasmic reticulum,Golgi apparatus,Lysosomes,A
All of the following are functions of the cell membrane EXCEPT:,Passive transport,Active transport,Protein synthesis,Bulk transport,C
Which type of RNA carries genetic codons to ribosomes?,mRNA,tRNA,rRNA,snRNA,A
A cell with prominent heterochromatin and a dark-staining nucleus is most likely:,Inactive,Highly active,Undergoing division,Secreting proteins,A
Which of the following describes the function of telomeres?,Preserve chromosome ends,Attach spindle fibers,Hold sister chromatids,Organize nucleoli,A
A biopsy shows cytoplasmic basophilia. This is most likely due to abundant:,Rough endoplasmic reticulum,Smooth endoplasmic reticulum,Mitochondria,Lysosomes,A
Which organelle contains its own DNA and can undergo binary fission?,Mitochondria,Lysosomes,Peroxisomes,Golgi apparatus,A
A patient presents with poor drug metabolism due to SER dysfunction. Which organ is primarily affected?,Liver,Heart,Brain,Kidney,A
Which staining combination is universally used for routine histological examination?,Hematoxylin and eosin,Periodic acid-Schiff,Sudan black,Iron hematoxylin,A
During paraffin technique what is the purpose of dehydration?,Remove water from tissue,Harden the tissue,Make tissue transparent,Dissolve lipids,A
Which of the following is NOT a type of lysosome?,Primary lysosome,Secondary lysosome,Autophagosome,Peroxisome,D
A cell shows a negative Golgi image under light microscope. This appears as:,Non-stained area in basophilic cytoplasm,Deeply stained area in cytoplasm,Electron-dense vesicles,Basophilic granules,A
Which organelle is responsible for forming the mitotic spindle?,Centrioles,Mitochondria,Golgi apparatus,Endoplasmic reticulum,A
All of the following are functions of the Golgi apparatus EXCEPT:,Protein modification,Lysosome formation,ATP synthesis,Cell membrane renewal,C
A newborn infant presents with jaundice due to underdeveloped SER. What is the accumulated substance?,Bilirubin,Glycogen,Lipofuscin,Uric acid,A
Which of the following is true about the nucleolus?,Site of ribosome assembly,Surrounded by a membrane,Contains mainly DNA,Present only during cell division,A
A cell with extensive RER and a prominent nucleolus is most likely:,Actively synthesizing proteins,Storing lipids,Undergoing division,Inactive,A
Which of the following describes facilitated diffusion?,Assisted by proteins,Requires energy,Against concentration gradient,Involves vesicle formation,A
A patient with muscle contraction problems may have dysfunction in which organelle?,Sarcoplasmic reticulum,Rough ER,Golgi apparatus,Peroxisomes,A
Which of the following is NOT a characteristic of euchromatin?,Darkly stained,Genetically active,Less compact,Prominent in active cells,A
During tissue processing which step replaces alcohol with xylene?,Clearing,Dehydration,Impregnation,Fixation,A
Which organelle contains hydrolytic enzymes?,Lysosomes,Peroxisomes,Mitochondria,Golgi apparatus,A
A cell with abundant SER is most likely involved in:,Lipid synthesis,Protein synthesis,ATP production,Digestion,A
Which of the following is true about ribosomes?,Composed of two subunits,Surrounded by membrane,Found only in cytoplasm,Synthesize lipids,A
A patient presents with accumulation of undigested glycogen in cells. This suggests deficiency in:,Lysosomal enzymes,Peroxisomal enzymes,Mitochondrial enzymes,Golgi enzymes,A
Which of the following describes the sodium-potassium pump?,Active transport requiring ATP,Passive diffusion,Facilitated diffusion,Osmosis,A
All of the following are types of RNA EXCEPT:,mRNA,tRNA,rRNA,dRNA,D
A biopsy sample shows cells with signet ring appearance. This indicates accumulation of:,Lipids,Glycogen,Proteins,Pigments,A
Which organelle is responsible for drug detoxification?,Smooth endoplasmic reticulum,Rough endoplasmic reticulum,Golgi apparatus,Lysosomes,A
A cell culture requires observation of fluorescently labeled antibodies. Which microscope is needed?,Fluorescence microscope,Phase-contrast microscope,Bright-field microscope,Electron microscope,A
Which of the following is NOT a function of mitochondria?,ATP production,Calcium regulation,Apoptosis role,Protein synthesis,D
During paraffin embedding what temperature range is used for paraffin wax?,55-60°C,37-40°C,70-80°C,20-25°C,A
A patient with skin coloration abnormalities may have issues with which pigment?,Melanin,Hemoglobin,Lipofuscin,Bilirubin,A
Which of the following describes the glycocalyx?,Cell coat of glycoproteins and glycolipids,Inner nuclear membrane,Matrix of mitochondria,Cristae of mitochondria,A
All of the following are non-membranous organelles EXCEPT:,Ribosomes,Microtubules,Filaments,Lysosomes,D
A cell with numerous peroxisomes is most active in:,Detoxification reactions,Protein synthesis,ATP production,Calcium storage,A
Which of the following is true about nuclear envelope?,Double membrane with pores,Singe membrane,No pores,Continuous with SER only,A
A patient presents with neurological symptoms due to accumulated lipofuscin. This represents:,Residual bodies in long-lived cells,Active lysosomes,New mitochondria,Secretory granules,A
Which organelle is involved in the formation of secretory granules?,Golgi apparatus,Mitochondria,Nucleus,Peroxisomes,A
During tissue sectioning what thickness is typical for light microscopy?,5-7 µm,20-30 µm,1-2 µm,50-100 µm,A
Which of the following describes chromatin?,DNA-protein complex,RNA-protein complex,Lipid-protein complex,Carbohydrate-protein complex,A
A cell with abundant polysomes is actively engaged in:,Protein synthesis,Lipid synthesis,Glycogen storage,Detoxification,A
All of the following are functions of lysosomes EXCEPT:,Digestion of engulfed material,Autophagy of organelles,ATP synthesis,Release of enzymes,C
Which organelle shows elementary particles on its cristae?,Mitochondria,Golgi apparatus,Endoplasmic reticulum,Lysosomes,A
A patient with respiratory enzyme deficiency likely has dysfunction in:,Mitochondria,Lysosomes,Peroxisomes,Golgi apparatus,A
Which of the following is true about the resolution of light microscope?,0.2 µm,0.2 nm,2.0 µm,20 nm,A
During staining procedure what is the purpose of rehydration?,Replace xylene with water,Remove water,Clear tissue,Hard tissue,A
Which organelle is responsible for ribosome formation?,Nucleolus,Nucleus,Golgi apparatus,Mitochondria,A
A cell with numerous secondary lysosomes is actively engaged in:,Digestive processes,Protein synthesis,Energy production,Lipid synthesis,A
All of the following are components of the cytoskeleton EXCEPT:,Microtubules,Intermediate filaments,Actin filaments,Ribosomes,D
Which of the following describes pinocytosis?,Cell drinking,Cell eating,Active transport,Protein synthesis,A
A patient with connective tissue disorder may have abnormalities in which filament?,Vimentin,Keratin,Desmin,Myosin,A
Which organelle is continuous with the nuclear outer membrane?,Rough endoplasmic reticulum,Smooth endoplasmic reticulum,Golgi apparatus,Mitochondria,A
During electron microscopy what provides the 1000-fold increase in resolution?,Shorter electron wavelength,Better stains,Thinner sections,Higher magnification,A
Which of the following is NOT a characteristic of heterochromatin?,Genetically active,Darkly stained,Compact,Present in inactive cells,A
A cell with extensive Golgi apparatus is likely:,Secreting macromolecules,Storing energy,Detoxifying drugs,Synthesizing DNA,A
All of the following are types of cell transport EXCEPT:,Simple diffusion,Facilitated diffusion,Active transport,Protein synthesis,D
Which organelle contains cytochrome P450 enzymes?,Smooth endoplasmic reticulum,Rough endoplasmic reticulum,Golgi apparatus,Lysosomes,A
A patient with karyotype 45 XO has:,Turner syndrome,Down syndrome,Klinefelter syndrome,Edward syndrome,A
Which of the following describes the function of centrioles?,Form mitotic spindle,Protein synthesis,Energy production,Detoxification,A
During tissue processing what is the purpose of impregnation?,Fill spaces with paraffin,Remove water,Clear tissue,Fix tissue,A
Which organelle is responsible for lipid metabolism?,Smooth endoplasmic reticulum,Rough endoplasmic reticulum,Golgi apparatus,Lysosomes,A
A cell with abundant glycogen particles is storing:,Carbohydrates,Lipids,Proteins,Pigments,A
All of the following are inclusions EXCEPT:,Glycogen,Lipids,Pigments,Ribosomes,D
Which of the following describes the function of microtubules?,Form cytoskeleton,Protein synthesis,Energy production,Lipid synthesis,A
A patient with epidermolysis bullosa may have defects in:,Keratin filaments,Vimentin filaments,Desmin filaments,Myosin filaments,A
Which organelle is involved in the formation of autophagosomes?,Lysosomes,Peroxisomes,Mitochondria,Golgi apparatus,A
During immunohistochemistry what is used to identify specific proteins?,Labeled antibodies,Special stains,H&E staining,Electron microscopy,A
Which of the following is true about DNA?,Double helix with deoxyribose,Single strand with ribose,Contains uracil,Found only in nucleus,A
A cell with prominent nucleolus is:,Actively synthesizing ribosomes,Inactive,Undergoing division,Storing lipids,A
All of the following are functions of the nucleus EXCEPT:,Genetic control center,Site of DNA replication,Site of protein synthesis,Coordinates cell activities,C
Which organelle is responsible for H2O2 degradation?,Peroxisomes,Lysosomes,Mitochondria,Golgi apparatus,A
A patient with bile metabolism issues may have dysfunction in:,SER of liver cells,RER of pancreas,Mitochondria of muscle,Golgi of neurons,A
Which of the following describes the structure of chromosomes?,Condensed chromatin,Extended chromatin,Circular DNA,Single DNA strand,A
During enzyme histochemistry why is cryostat sectioning used?,Preserve enzyme activity,Avoid dehydration,Better staining,Faster processing,A
Which organelle is responsible for membrane synthesis and repair?,Smooth endoplasmic reticulum,Rough endoplasmic reticulum,Golgi apparatus,Lysosomes,A
A cell with numerous mitochondria is likely:,Energy-demanding,Storage function,Detoxifying,Secreting,A
All of the following are characteristics of cell culture EXCEPT:,Allows observation of cellular behavior,Requires intact animals,Useful for vaccine production,Essential for some experiments,B
Which of the following describes the function of tRNA?,Brings amino acids to ribosomes,Carries genetic code,Forms ribosomes,Stores genetic information,A
A patient with cardiac disease may have mitochondrial dysfunction affecting:,Energy production,Protein synthesis,Lipid metabolism,Detoxification,A
Which organelle is involved in the formation of multivesicular bodies?,Lysosomes,Peroxisomes,Mitochondria,Golgi apparatus,A
During fluorescence microscopy what is required for examination?,Dark room,Bright light,Phase contrast,Electron beam,A
